{
  "schema_version": 1,
  "record_type": "ctx.runtime_snapshot",
  "snapshot_id": "01ARZ3NDEKTSV4RRFFQ69G5FAX",
  "captured_at": "2026-08-03T06:00:00Z",
  "device_id": "personal-macbook",
  "task_id": "01ARZ3NDEKTSV4RRFFQ69G5FAV",
  "active_checkpoint_id": "01ARZ3NDEKTSV4RRFFQ69G5FAT",
  "previous_snapshot_id": "01ARZ3NDEKTSV4RRFFQ69G5FAS",
  "trigger": {
    "kind": "lifecycle-hook",
    "name": "Stop"
  },
  "producer": {
    "actor_type": "agent",
    "system": "com.anthropic.claude-code",
    "version": "1.0.0",
    "adapter": "ctx.adapters.claude-code",
    "device_id": "personal-macbook",
    "extensions": {}
  },
  "repository": {
    "repo_id": "ai-kit-local",
    "working_copy_id": "ai-kit-personal-main",
    "root_uri": "file:///Users/example/work/ai-kit",
    "git": {
      "object_format": "sha1",
      "head": {
        "state": "attached",
        "symbolic_ref": "refs/heads/main",
        "oid": "0123456789abcdef0123456789abcdef01234567"
      },
      "upstream": {
        "remote": "origin",
        "ref": "refs/remotes/origin/main",
        "oid": "0123456789abcdef0123456789abcdef01234567",
        "ahead": 0,
        "behind": 0
      },
      "operation": {
        "kind": "none"
      },
      "worktree": {
        "state": "dirty",
        "fingerprint": {
          "profile": "ctx-git-worktree-v1",
          "digest": "sha256:cccccccccccccccccccccccccccccccccccccccccccccccccccccccccccccccc"
        },
        "changes": {
          "complete": true,
          "total_entries": 1,
          "untracked_included": true,
          "ignored_included": false,
          "entries": [
            {
              "path": "README.md",
              "index_status": "unmodified",
              "worktree_status": "modified",
              "conflict": false,
              "worktree_content_digest": "sha256:bbbbbbbbbbbbbbbbbbbbbbbbbbbbbbbbbbbbbbbbbbbbbbbbbbbbbbbbbbbbbbbb"
            }
          ]
        }
      }
    }
  },
  "session_refs": [
    {
      "session_ref_id": "session-claude-authoring",
      "system": "com.anthropic.claude-code",
      "session_id": "provider-session-123",
      "relation": "authoring",
      "logs": [
        {
          "log_ref_id": "log-claude-authoring-runtime",
          "locator": {
            "kind": "home_path",
            "device_id": "personal-macbook",
            "path": ".claude/projects/example/provider-session-123.jsonl"
          },
          "media_type": "application/x-ndjson",
          "format": "jsonl",
          "adapter": "ctx.adapters.claude-code-jsonl",
          "adapter_version": "1.0.0",
          "selector": {
            "kind": "opaque",
            "value": "session:provider-session-123"
          },
          "resource_digest": "sha256:aaaaaaaaaaaaaaaaaaaaaaaaaaaaaaaaaaaaaaaaaaaaaaaaaaaaaaaaaaaaaaaa",
          "description": "The original agent session log on the producing device.",
          "extensions": {}
        }
      ],
      "extensions": {}
    }
  ],
  "capture": {
    "completeness": "complete",
    "warnings": [],
    "omitted_sections": []
  },
  "content_digest": "sha256:cc960d9575e7f9ea0c3a76e8c18553ec9380646b3fc83d6d9c3594f35554cd1f",
  "extensions": {}
}
